Title,Author,Score,URL,Created_UTC,Content
"Warren Buffett said he can get a 50% annual return if he is managing small sum of money, do you think it's possible?",Key_Type_4102,644,https://www.reddit.com/r/investing/comments/1fda1ne/warren_buffett_said_he_can_get_a_50_annual_return/,1725944272.0,"https://youtu.be/v4T1oknATGU?si=MS4IEFprcrxuh5wq

Do you guys think Warren Buffett can really do it?
50% annual return on small capital?

Warren Buffett said he can get a 50% annual return if he is managing small sum of money, do you think it's possible?

Some people claimed that his method of value investing with huge yearly returns and low risks wouldn't work in today's era because information spreads too fast due to Internet. And some people just claims stocks thats 50% undervalued just don't exist in the current market.

What do you guys think? And if it's possible, how are we going to take advantage of it?"
Advice On What I Should Do?,Competitive-Ad4561,1,https://www.reddit.com/r/investing/comments/1fd90up/advice_on_what_i_should_do/,1725940570.0,"I’ve always heard how the first 100k is the hardest and im halfway there (50/50 VOO &amp; QQQ) but I really want to get into real estate investing. The main question is:
Should I invest in index funds until I hit 100k, or pivot into saving up for a rental property? 

I can handle the demand of a rental, I just dont know if I want to wait to hit 100k in stocks first. "
"Have little mortgage on new home and equity, or invest funds from sale of old home into something else?",OurAngryBadger,4,https://www.reddit.com/r/investing/comments/1fd8nit/have_little_mortgage_on_new_home_and_equity_or/,1725939284.0,"Hi, advice wanted. Buying a new home for $490,000. Already putting up $150k as the down payment, bringing the mortgage to $340,000.

Selling old home as well, should get about $300k for it.

Would you take the $300k, put it on the new house so there's only a $40k mortgage, equity in the home, low monthly payments, etc.

Or take the $300k and invest it elsewhere to pay the $340k monthly mortgage payment (probably about 3,300 / month) off of dividends or something like interest in a high yield savings?

In case it's important, the new home is fairly new and built well with little to no problems, good resale value, nice property, etc. So having equity in it isn't the worst thing."
Evaluating Down Payment Options for Home Purchase: Impact on Investment Portfolio,oohk1llem,0,https://www.reddit.com/r/investing/comments/1fd8jzd/evaluating_down_payment_options_for_home_purchase/,1725938950.0,"As the title reads I'm facing a decision about how much to put down on a new home and am curious about its impact on my investment portfolio. Here’s a brief overview of my financial situation:

* **Home Purchase**: $815k with options for different down payments.
* **Income**: Combined $330k/year between my wife and I.
* **Current Assets**:
   * **Stocks**: $790k
   * **Cash**: $60k
   * **Retirement Accounts (IRA, 401k, etc.)**: Total $348k
   * **HSA**: $15k
* **Scenarios**:
   * **1:** Larger down payment of $407,500, reducing monthly mortgage payments but requiring significant stock liquidation.
   * **2:** Smaller down payment of $163,000, retaining more stocks for potential market growth but leading to higher monthly payments.
   * **3:** Middle-ground down payment of $282,500.

Given the current market dynamics and potential for growth, I'm evaluating whether to keep more invested or reduce financial strain with a larger down payment. What strategies would you suggest considering both market conditions and personal financial safety? Thanks for your insights!"
Best Stocks/ETFs to invest in for 10-15 year growth?,Old-Food2140,2,https://www.reddit.com/r/investing/comments/1fd7gak/best_stocksetfs_to_invest_in_for_1015_year_growth/,1725935459.0,I’m 18 years old and going into college this year. Currently I’ve thrown 500 dollars into a Roth with mostly VOO and some other ETFs so that I can start building compound interest. Just interested in the safest options for 10-15 years of growth if I put 500 dollars in a general brokerage account. Would be looking to possibly use the money down the line to help put a down payment on a house or pay off college loans. 
Good position tracking with after hours updates?,Ok_Subject_2220,2,https://www.reddit.com/r/investing/comments/1fd5zrl/good_position_tracking_with_after_hours_updates/,1725931010.0,When my account moved from Schwab to TDA my totals no longer reflect price movement before mkt open or after the close. I'm looking for suggestions where I can input my holdings and get updated totals outside of normal trading hours. Maybe 50 line items. Thanks!
Company seems to be setting up for layoffs. What can I do with 200k cash to generate some income?,Pale_Yoghurt_9549,0,https://www.reddit.com/r/investing/comments/1fd4zww/company_seems_to_be_setting_up_for_layoffs_what/,1725928053.0,"Currently have about 200k net worth, mostly in cash sitting in a HYSA. Now that the threat of layoffs are out there I'm wondering if there is anything better that I can do with the cash to generate income rather than a HYSA?

Currently earning 4.4% APY will probably go down once instrest rates drop. "
Assets negatively correlated with stocks?,ZjY5MjFk,6,https://www.reddit.com/r/investing/comments/1fd4vwu/assets_negatively_correlated_with_stocks/,1725927717.0,"In two investment books I've read now, they both suggest that ""Obviously of course, it assumes you have other assets negatively correlated with the broad equity market"".  But they don't give any suggestions on what these assets may be ?  They are assuming that ""other assets performing very well when stocks are do very poorly"" to ""smooth out the volatility of the stock market while maintaining a higher rate of return over time""


Ray Dalio (famous investor/author) also suggests that you can reduce risk while keeping same expected returns if you ""simply"" having 10 to 12 assets that are uncorrelated with each other.

--

All this sounds good in theory, but in practicality, how do you determine if two assets are negatively correlated (and/or uncorrelated) to each other ? Does this show up on stock/ETF screeners as some weird name I'm not familiar with ? 

What asset classes should I look into if I want a ""portfolio with balanced correlations to reduce overall risk?""


I've heard people suggest bonds, gold, commodities, real estate, international stocks or even crypto currencies, but how do I prove their level of correlation?  I'm assuming the industry already has a good metric for this and just don't know the term ?"
Is USFR safe to use and how does it work?,Loagn1gd,0,https://www.reddit.com/r/investing/comments/1fd38xb/is_usfr_safe_to_use_and_how_does_it_work/,1725923057.0,I have a lot of cash sitting in my checking and want to move it to Robinhood to start making more money out of it safely. I tried looking for money markets but couldn’t find it on Robinhood. I saw USFR is a good alternative but how does it work because I notice it goes up and down every month.
Wealth management company suggestions,atashi-wa,0,https://www.reddit.com/r/investing/comments/1fd2yim/wealth_management_company_suggestions/,1725922275.0,"I'm looking for a wealth management company that can ensure I get the best financial, tax, and estate returns. I recently had a meeting with Fidelity, but it felt like I was the one who had to come up with the right questions and solutions, instead of them offering proactive guidance. Does anyone have suggestions for a firm that provides more hands-on, comprehensive advice?"
Question about Tax Deferred Retirement Account,Dazzling_Analyst_920,1,https://www.reddit.com/r/investing/comments/1fd2b6b/question_about_tax_deferred_retirement_account/,1725920492.0,"Hello guys!

My mom is retiring soon from a county job position and she told me that her Empower (ex-Horizons Deferred Compensation Plan) is giving her 7 years after retirement to stay with them and after 7 years she needs to find somewhere to transfer the money.

She says the benefits of the retirement account are extremely minimal and she gets very little returns through this account.

So she wants to transfer the money out elsewhere.

Her retirement agent mentioned to her about an annuity.

I don’t know how stable an annuity is and so I was wondering if there was a way liquidate her retirement account and move it to a pre-tax traditional Roth account.

If this sounds bad, can you guys give me other ideas of what she might be able to do?

Thank you so so much in advanced!"
Tbill Interest Question – how\when are they appropriated\budgeted ???,B00B00_,3,https://www.reddit.com/r/investing/comments/1fd23v4/tbill_interest_question_howwhen_are_they/,1725919944.0,"This may be a weird question, but I’m curious about interest and repayment on US Treasury Debt.

It’s an entitlement and not a discretionary spend so no extra budget or authorization is needed as long as we don’t go over the allocated budget amount for the year. (Please correct me if I’m wrong here!!!)

Which spending bill needs to be authorized for these payments? Is this approved during the debt ceiling discussion or sometime else?

 

What bill\\budget\\authorization is needed to ensure the interest and repayment is paid in the future?"
Best options for excess cash ,Boston_Jon_189,15,https://www.reddit.com/r/investing/comments/1fd0tj7/best_options_for_excess_cash/,1725916698.0,"I have slowly been accumulating cash savings and wondering what better options might be out there other than CDs. 

What started as a 6month emergency fund has, over the last 5-7 years, become ~$300k. Right now 3/4 of it is parked in short duration CDs at 5% APY. 

No debt except what’s left of a mortgage - $250k at 2.25%. 

Actively funding 529 accounts for the kids. 

Invest the max into traditional IRAs each year ($7k this year) and max out my 401k contributions. 

I’m in my early 40s with two kids in grade school. 

I don’t invest in crypto or individual equites. 

"
Should I switch to a fee vs. % based investment firm?,-McSlizzy-,0,https://www.reddit.com/r/investing/comments/1fd084v/should_i_switch_to_a_fee_vs_based_investment_firm/,1725915275.0,"I currently have \~$150k sitting with an investment firm that charges 1%. I realize this is a pittance to most firms. The returns aren't great and appear to be on autopilot / not actively managed. For this I pay $390/quarter, like clockwork as well. This account consists solely of old 401k's which I rolled over. I don't really have any huge life things to plan for minus retirement. Should I switch from % based to something else?

EDIT: Yeah, so sounds like I’m getting kind of screwed. What avenue do I use to transfer the account to a self managed one without tax implications? Is it something I can do myself, or should I pay someone? I have Schwab and Fidelity for other accounts if it matters. Y’all rock 🤘"
ESPP transition to ROTH IRA?,TravRado1024,0,https://www.reddit.com/r/investing/comments/1fcz8jt/espp_transition_to_roth_ira/,1725912866.0,"Hey All -

I recently enrolled in my company's new ESPP program, in which I purchase each pay period (biweekly), and receive 15% off of the current stock price at that time of purchase. Is there a benefit to me rolling that over to my traditional IRA and then over to my Roth IRA biweekly? (I do the backdoor ROTH IRA process)

Or is there a better way to capitalize on my earnings?

New to this whole thing, so any advice is appreciated. Thanks

Edit to add: I already max out my employer contribution to my 401k + some"
ETF investing - market spread fees,HappyPints,0,https://www.reddit.com/r/investing/comments/1fcx9a9/etf_investing_market_spread_fees/,1725908183.0,"So I invest £40 every 2 weeks into SPY (I’m a small time, passive investor).

I’ve noticed in my trading account that despite depositing £40, and placing a market order, sometimes the actual trade starts at around £38, some of my trades even started off as low as £37.50 - which means that the trade has to increase by 8% just to break even.

I believe this is the market spread fee, does this seem pretty high? Or does this seem about right?

I use eToro, which has a small currency conversion (£ &gt; $), but other than that, they don’t charge any transaction fee etc."
US Bitcoin ETFs Face Record Outflows Amid Market Volatility,OkLiterature9978,45,https://www.reddit.com/r/investing/comments/1fcviht/us_bitcoin_etfs_face_record_outflows_amid_market/,1725903900.0,"US Bitcoin ETFs have seen nearly $1.2 billion in outflows over eight days ending September 6, 2024, marking their longest net outflow streak. This reflects broader investor caution due to global economic uncertainties and shifting market conditions.

[https://thedeepdive.ca/us-bitcoin-etfs-face-record-outflows-amid-market-volatility/](https://thedeepdive.ca/us-bitcoin-etfs-face-record-outflows-amid-market-volatility/)"
Investing for Kids and teaching them - recommended Apps and also situational advice,babbagack,0,https://www.reddit.com/r/investing/comments/1fcuzov/investing_for_kids_and_teaching_them_recommended/,1725902595.0,"Fortunately the kids are blessed with some birthday or holiday money from time to time.  And they would literally spend $50-100 on Roblox if they could.

I want to teach them the habit of being charitable, spending on oneself, and investing.  The last one is something I didn't catch onto until much later in life.  

I fortunately already have investment accounts for them in an ETF that gets invested into quarterly, not tons but it is fortunately something.

I want them the ability to see their money grow, but I don't know if it is wise to show them their personal investment accounts right now that I have set up for them (they are younger kids), but instead later in life when they are near college or so.

Should I just find some ""kid friendly"" app they can put on their tablet and put part of their gift money into over time, or should I just share those investment accounts with the kids now and have them add to the already existing bigger pool?

The latter makes more over time of course for them, by a little, but maybe it is better to just have them have their own little accounts/apps?

I don't know what app/s are good to use, appreciate any recommendation. I use fidelity for retirement and stuff, and have some other accounts I plan to get into fidelity as well.  Apparently they have some kids app but I have not looked into it yet"
