Title,Author,Score,URL,Created_UTC,Content
Has Seeking Alpha changed recently?,Mossback5280,0,https://www.reddit.com/r/investing/comments/1fg04qp/has_seeking_alpha_changed_recently/,1726247827.0,"Has something happened to Seeking Alpha in the last few weeks? I used to be able to read a number of authors' free articles, but recently everything has been locked down behind their paywall, with promos asking me to sign up for premium. I can't tell what articles are free any more. Are there any?"
How would you invest in this financial position ,Gorillazinsuits,3,https://www.reddit.com/r/investing/comments/1ffzxg9/how_would_you_invest_in_this_financial_position/,1726247313.0,"What would you do in this position 

I am a 24 year old with a degree and finance and work as a full time actor. I am fortunate enough to have the ability to pay my bills with the grace of putting some away in savings (5.5% APY) while living in California. 

I am super proud of the position I am in financially, but want to know what someone progressive would do to keep the money circulating and growing. Based on the following below, what would be a very reasonable investment to profit from?

- 24 year old
- living in Cali
- 790 credit score
- $30,000 in savings 
- $12,000 401(k)
- Annual income: ~$60k
- Monthly expenses: ~$3,700

Any advice would be super beneficial. "
"When stocks are sold at a high price for profit, who is it sold to",FarAd336,0,https://www.reddit.com/r/investing/comments/1ffzaai/when_stocks_are_sold_at_a_high_price_for_profit/,1726245686.0,"Let me put in some context here. Imagine a company selling their stocks of an item that has reached a price of 100 dollars that had previously been 50. When the company sees the mass profit of this price, they sell it. But who would buy that stock at that price, knowing it's an expense and it is unrealistic for it to be profitable over and over again. Not all items can be having rising prices forever and making profit for those who stocks are sold to. 

Example, a company buys chocolate stocks. Each chocolate bar is 2 dollars. After buying the stocks and waiting for a sweet spot, the price reaches 6 dollars. The stocks are sold, but the investor who buys these stocks, how would they make any profit from a 6 dollar chocolate bar since increasing that price would be ridiculously expensive for an average person who buys groceries in a commercial market."
I am considering to diversify portfolio with ETFs,Ok_Secret4642,0,https://www.reddit.com/r/investing/comments/1ffz5wa/i_am_considering_to_diversify_portfolio_with_etfs/,1726245376.0,"Hello, I am investing in the stock market for the past 2 years and 1 month maybe. My portfolio has made a significant growth (43% first year, 10% YTD). These past 2 months were a bit rough to my investments, going from 35% YTD to 10% and I am considering starting to invest in ETFs. 

At this moment, I am looking at VOO and VWCE from Vanguard. Any advice on other steady growth ETFs, also thoughts on my 2 picks ?"
Is it smart to sell stocks now and then to grab the profit and then immediately re-invest?,Esdoornhelikoptertje,0,https://www.reddit.com/r/investing/comments/1ffz233/is_it_smart_to_sell_stocks_now_and_then_to_grab/,1726245107.0,"We are having this discussion here if let's say you buy stocks, they go up 20%. You sell them to grab the profit. Then re-invest the capital plus gains so any next unrealised losses are on the entire capital including profit instead of only on your initial capital. Does this makes your portfolio not grow much faster? 

The plan would be to sell all the stocks as soon as they reach 20, 30, or more percent and then immediately re-purchase them. Some stay this isn't any better than just holding the stocks. But I disagree, but I have difficulty getting the formulas right. I get that a bad year would still have effect, but good years will have a much better effect than for someone who held right, because the profit is now fixated? If stocks rise again by 20%, it will be an a lot more money? "
Value investing in (UK) life insurance companies,Pipthagoras,6,https://www.reddit.com/r/investing/comments/1ffwqk1/value_investing_in_uk_life_insurance_companies/,1726239295.0,"If I'm not mistaken, comparing the book value of (UK) life insurance companies is not straightforwards and punished accounts are of limited use to this end.

Most insurers invest heavily in illiquid private assets which have no observable market value, so asset values will be spurious. Sure they can discount expected asset cashflows, but allowances for credit risk in these calculations will require expert judgment and will vary from company-to-company.

Similarly, liability values are based on assumptions which are not published (or at-least not with sufficient granularity and alongside the demographic make-up of liability portfolios to validate quoted liability values). If I can't compare the mortality assumptions, for example, made by 2 different companies then how can I compare the quoted values of their liabilities?

With such long-tailed assets and liabilities and no disclosure of assumptions or valuation approaches, how does one objectively compare the accounts of two life insurers? Obviously regulation such as IFRS17 \_should\_ make accounts comparable, but only to a limited extent since the level of prudence used by different insurers will vary.

  
I've stipulated that this question relates to UK life insurers because I have a vague understanding of how UK life insurers accounts are prepared - but the question may well relate to various types of insurance company in various countries for all I know."
Curiosity stream (CURI) has 40 million in cash and is worth 100 million,SmartBets,0,https://www.reddit.com/r/investing/comments/1ffw2fi/curiosity_stream_curi_has_40_million_in_cash_and/,1726237589.0,"Hey,

  
Curiosity stream has been a disaster for early investors, but last month has given rise to a 75% profit.

Volumes in trading has increased substantially in August and September. 

Q2 quarter report saw 2.5 million in revenue. If that keeps up, or slightly increases I see this upper trajectory continuing.

  
Marketing is definitely not slowing down and spend is still  there according to reports from CEO and anecdotal from my viewings in youtube. What do you guys think? A buy?

"
1yr hold on newly opened Vanguard acct.,Meathead1961,0,https://www.reddit.com/r/investing/comments/1ffw17o/1yr_hold_on_newly_opened_vanguard_acct/,1726237499.0,"I opened a money market account with Vanguard in June to park an emergency fund. I tried to move a small amount to my linked checking account just to see the time frame for transfers between accounts. I wasn’t able to access the funds and when I called I was told there would be a 1yr hold on the acct, preventing transfers. I was told this is a new policy to prevent possible money laundering. I argued with the rep that nowhere on their website disclosed this and he assured me that if I needed funds in an emergency, they could overide the policy but it would take extra steps and a couple of days to complete.
Is this standard in new accounts in other companies?"
Emerging Markets or Just India?,UpbeatGarden3746,18,https://www.reddit.com/r/investing/comments/1ffshfy/emerging_markets_or_just_india/,1726227314.0,"As a 24-year-old investor with a long-term horizon, I'm trying to build a growth-oriented portfolio. Right now, I’m considering allocating 85-90% in VOO and 10-15% in emerging markets for international exposure. However, given India's rising prominence as a rapidly growing economy, I’m wondering if it might be better to shift my international allocation to Indian stocks instead of broader EM exposure.

India is projected to be one of the fastest-growing economies over the next few decades, driven by its young population, technological advancements, and economic reforms. Considering that, would a portfolio of 85-90% in VOO and 10-15% in Indian stocks potentially outperform the more traditional VOO and EM allocation? Should I focus on India’s long-term potential for stronger growth instead of diversifying across all emerging markets?"
"Daily General Discussion and Advice Thread - September 13, 2024",AutoModerator,8,https://www.reddit.com/r/investing/comments/1ffq68w/daily_general_discussion_and_advice_thread/,1726218069.0,"Have a general question?  Want to offer some commentary on markets?  Maybe you would just like to throw out a neat fact that doesn't warrant a self post?  Feel free to post here! 

If your question is ""I have $10,000, what do I do?"" or other ""advice for my personal situation"" questions, you should include relevant information, such as the following:

* How old are you? What country do you live in?  
* Are you employed/making income? How much?  
* What are your objectives with this money? (Buy a house? Retirement savings?)  
* What is your time horizon? Do you need this money next month? Next 20yrs?  
* What is your risk tolerance? (Do you mind risking it at blackjack or do you need to know its 100% safe?)  
* What are you current holdings? (Do you already have exposure to specific funds and sectors? Any other assets?)  
* Any big debts (include interest rate) or expenses?  
* And any other relevant financial information will be useful to give you a proper answer.  

Please consider consulting our FAQ first - https://www.reddit.com/r/investing/wiki/faq
And our [side bar](https://www.reddit.com/r/investing/about/sidebar) also has useful resources.  

If you are new to investing - please refer to Wiki - [Getting Started](https://www.reddit.com/r/investing/wiki/index/gettingstarted/)

The reading list in the wiki has a list of books ranging from light reading to advanced topics depending on your knowledge level. Link here - [Reading List](https://www.reddit.com/r/investing/wiki/readinglist)

Check the resources in the sidebar.

Be aware that these answers are just opinions of Redditors and should be used as a starting point for your research. You should strongly consider seeing a registered investment adviser if you need professional support before making any financial decisions!"
platform/trading app suggestion for Canadian citizen,Shao_Ling,12,https://www.reddit.com/r/investing/comments/1ffnq04/platformtrading_app_suggestion_for_canadian/,1726207203.0,"/title - I've looked at Scotiabank iTrade, being a Scotia client .. it seemed to be the easiest way to go - I can just move cash from checking to investment account, etc.

idk - it's a maybe

Interactive Brokers .. I tried to register a cash account, it wouldn't let me unless I entered 1M+ in assets or I wouldn't be able to trade options .. or just go through with the registration process at all

Questrade or Wealthsimple? 

what are your best pick(s) for a small account (starting with about 1000$ CAD) and make some short-term 15-30-45 DTE trades, small and easy .. I wouldn't want all trades to be at 4.99/8.99$ but rather a % for commission .. I don't know 

thank you  
"
Capital Group American Funds claims they HAVE and CAN beat the indexes…,Dramatic-Ferret-5990,1,https://www.reddit.com/r/investing/comments/1ffng3y/capital_group_american_funds_claims_they_have_and/,1726206048.0,"Here is the article: https://www.capitalgroup.com/individual/pdf/shareholder/MFGEBR-097-619801.pdf

I have done my fair share of research into investing, different mutual funds, indexes and talked to a multitude of different financial advisors over the years. This Northwestern Mutual advisor (a friend sells insurance for them and offered a free meeting with one of their actual financial advisors, so I figured why not). Got in a long discussion about funds he believes in and why. He was preaching American Funds up and down. 

Not my first time hearing the American Funds speech, but he sent me this article by them outright stating they beat out the S&amp;P in the long term by QUITE A BIT. I was a bit taken back by it. Reading over the article multiple times I still don’t necessarily understand the article and the math behind it. It feels like Cheerios telling me breakfast is the most important meal of the day. Or Welch’s telling me a glass of juice will make me live longer. Just seems like they would skew an article like this any way they could to boost investments.

It is a long article and a lot to take in, but interesting nonetheless and would love to see some critiques by people smarter than me as to what they think.

In my opinion American Funds specifically the growth fund of America has done historically well. Especially navigating the dot com bubble which really helps skew their lifetime data on how it compares. Navigating other financial crises they have done relatively average. All while charging high front end loads and ER’s. But never would think that over the long term it would be that much better than the S&amp;P.

What do I know? Not much…"
21 year old with 10k in the bank 7k in the market. What should I do? ,DesignerGlass6834,0,https://www.reddit.com/r/investing/comments/1ffncol/21_year_old_with_10k_in_the_bank_7k_in_the_market/,1726205665.0,"I am looking for advice on what to do with my money in the bank. I don’t have very many expenses rn as I am doing community college and living at home so I really just spend money on eating out a few times during the week. I don’t want to lock any money away in a Roth IRA. I would like to be able to pull money out to invest in entrepreneurial ventures in the coming years. 

I have 4.8k in a VTSAX and 3.4k in Tesla as of now. "
Withdrawals from investment accounts,ParallelMantis,0,https://www.reddit.com/r/investing/comments/1ffna7b/withdrawals_from_investment_accounts/,1726205392.0,"If you have 20,000 invested in something like a globally diversified index fund over 10+ years this gives an annualized return of 7% right? But let’s say you make monthly withdrawals of 140 regardless of the current return (so even if you were down). Does that kill investment gains massively thus money should be in a less risky investment or is it still worth it in a riskier index fund?"
How can small cap index ETF grow in long run?,SeriesNo2294,12,https://www.reddit.com/r/investing/comments/1ffmjee/how_can_small_cap_index_etf_grow_in_long_run/,1726202630.0,"For example market capitalization eligibility differs by index, but for S&amp;P SmallCap 600 it is US$ 1.0 billion to US$ 6.7 billion.

So assume that index starts at year 0 with 600 small cap companies, then they prosper and grow, so the index also grows, but at some point some of the top growers cross the upper market cap level and are dropped from the index and replaced with other small cap companies and you stop to benefit from the best performing companies in the index. 

Is it just a bet that most of small companies grow the fastest and as they grow too big they are dropped because it is believed that their growth will slow down?

"
Best investment to gift a 16 yo for (potential) long term,Comprehensive-Eye500,0,https://www.reddit.com/r/investing/comments/1ffkzsl/best_investment_to_gift_a_16_yo_for_potential/,1726197354.0,"Wondering what the best way to gift a granddaughter turning 16 with some sort of investment would be. She is actually very smart and interested in investing (as much as any 16 year old can be).

Looking for something neither of her parents could touch, so in her name and perhaps something she (grand daughter) cannot access until after 18 or 21 if possible. If she wants it needs it for college that will be her choice at sone point I guess.

I see a custodial account exists but not terribly familiar and looking for advice to teach and set up something for her future."
Rolling over money to IRA while still employed?,aTribeCalledLex,0,https://www.reddit.com/r/investing/comments/1ffk0mk/rolling_over_money_to_ira_while_still_employed/,1726194265.0,"Is it common and/or feasible for employers to allow employees “rollover/transfer” money from an employer 401k to a traditional IRA or Roth IRA while still remaining employed with said employer? 

If yes, are there any watchout or considerations in doing such thing such as capital gains tax or fees? 

I’m wanting to invest my money in individual stocks or possibly real estate opptys (self directed IRA), but have no plans to leave my employer. "
Monitoring Mutual Funds thru Google sheets?,jriker1,2,https://www.reddit.com/r/investing/comments/1ffgtme/monitoring_mutual_funds_thru_google_sheets/,1726184491.0,"I have been monitoring my EFT's with Google Sheets including the name of the stock, quotes, cost basis, dividends per share, annual dividend income and other things.  I also just hard code my CD's in there and just display the value of the CD after maturity in the annual dividend income field.  I just bought into BlackRock Treasury Trust Fund TTTXX in order to park some money there.  I have a decent amount in SGOV so figured it's best not to put more into that fund.  Anyway, does anyone know a good way to pull in data from these mutual funds?  Like to automate pulling in the name of the fund based on like TTTXX.  Obviously it's worth a $1 a share.  Not sure if it can pull in the current percent one should expect to make off it?  Or do I just need to hard code it and calculate the growth say until the end of the year manually?"
What do you think about the FOMC interest rates policy? Does this affect your investments and insights about the stock market?,Damn_Os,4,https://www.reddit.com/r/investing/comments/1ffghwk/what_do_you_think_about_the_fomc_interest_rates/,1726183523.0,"So the Federal Open Market Committee meeting is scheduled in 5 days and a lot of analysis have been done and a lot of market expectations rely on this, as I see the things the Federal Funds interests rates make leveraged positions more risky and make investors lean towards value instead of growth but what are your expectations about this meeting? and what decision are you expecting from the Fed? 

if a big interest rate cut happens would you change your investment strategy? If interest rates remains the same or higher than you expected what would you do?

After almost a year with over 5% Federal Funds interest rates what do you guys think?"
"Cannot buy VOO, Have VT, Hows this for a “third option”",Tourdrops,0,https://www.reddit.com/r/investing/comments/1fffcn9/cannot_buy_voo_have_vt_hows_this_for_a_third/,1726180284.0,"I day trade SPY. 
Because of wash rules I cannot invest as well. 

In my Roth I am 100% VT, dollar cost average 120 (max) weekly. 

I have decided I need a third account for Investing (taxable) and want opinions on this Portfolio of ETF’s. 

Is there any glaring noticeable problem/omissions from this portfolio

40% VTI 
15 % VXUS
5% BND

10% SCHD dividends

10% SCHG large cap growth

10% AVGV all equity value small cap

10% AVUV us only value small cap

Would you roll with this for 30 years or just go VTI/VXUS, or VT?

Any advice appreciated!"
Best method to DCA a sum of 100k?,PrestigiousFennel857,0,https://www.reddit.com/r/investing/comments/1ffd67d/best_method_to_dca_a_sum_of_100k/,1726174473.0,"I'm in a fortunate financial situation where I have a lump sum of 125k to put into the market solely for retirement (I'm likely going to go for VTSAX and its international counterpart--can't remember the name off the top of my head.) I'm in my early 30s, already have existing 401ks as well as a Roth IRA, but this sum will be confined to a standard brokerage account.

I'm lucky enough to live mortgage free with a LCOL and no debt, so the aforementioned sum can be comfortably put away for retirement, as my daily needs are minimal. What method should I use to DCA this money?"
"Financial Advisor Moved to Wells Fargo, Follow?",angelamar,0,https://www.reddit.com/r/investing/comments/1ffbvxj/financial_advisor_moved_to_wells_fargo_follow/,1726171248.0,"I’ve had a good relationship with my financial advisor, but he moved from Edward Jones to Wells Fargo. Should I move too? 

I was happy with my EJ experience and the fee is 0.5% higher than what it will be with WF. I was able to get an 18% return over 4 years and that helped with my down payment for my house. Since my person did a good job from the beginning and always communicated/met regularly, I am hesitant to switch. 

I’m concerned because of potential hidden fees, Wells Fargo’s reputation, and not seeing this company on top advisor lists. Anyone have experience with Wells Fargo advisors? Thanks in advance. "
Position transfer not complient with the Securities Trading Act ?,Quantum_Sushi,3,https://www.reddit.com/r/investing/comments/1ffbdez/position_transfer_not_complient_with_the/,1726169950.0,"Hi all !

On the 8th of August I required via email a transfer of positions from Trade Republic to Interactive Brokers.
They only recently got back with me (11th of September), telling me what I will sum up by ""we've been very busy sorry for the delay, but we're taking care of it now""

Okay then ! I replied asking if they had an estimation of how long it would take for the transfer to finally be executed.

Their answer, summed up :

- your demand has *now* been *treated*
- please understand it can take a few weeks
- you can read more about why in this article (which I can't link in this sub, it was a BaFin article)

Now what's interesting is that I actually went and read the article, which provided the following infos :

- According to the **Securities Trading Act (WpHG), article 69**, transfer orders must be executed ""immediatly and honnestly"". However this meant different things for companies and individuals, which led to an increase in complaints in 2020/2021

- Which then led to **article 63 of the WpHG** stating that these transfers must be executed within 3 weeks. If the company fails to do so for whatever reason, they have to inform the customer immediatly after this delay (within 5 business days after delay expiry)

- this was linked to a decision of Munich's superior tribunal, which considered that a company had ""failed in its obligations"" past this delay. **( OLG ) (19 U 1687/06)**

Now, in my case... Their last delay to notify me was on September 5th (accounting for the 5 business days period). They only sent me an email back on the 11th. On top of that, what I'm afraid is happening is that they are only processing this request now, which means I have to wait an extra ""few weeks"" (their terms), during which they told me it was critical not to sell my shares because it'd result in having to buy them back to cover the position etc.

What's annoying is that I was already frowning about these delays as the stock I'm transfering is very volatile and I believe could spike soon, which means I'd want to sell. But now, extra delay ?

So, I'm wondering if what I understood is correct, and if there's anything I can say/do in hopes of making this quicker, as they are not compliant with the regulations. Thanks so much for anyone who could light my lantern and help me with this, and have a great day !"
Update of paying off mortage vs investing in equities ,Apprehensive_Two1528,0,https://www.reddit.com/r/investing/comments/1ffa0g0/update_of_paying_off_mortage_vs_investing_in/,1726166527.0,"not sure if any one remembers, I posted a post 2 months ago and asked if I shall invest in equities or pay off my 7.885% ARM mortgage.

here is what I did.

Following the end of june discussion, I invested all liquid cash into a bucket of stocks and took the risk of a market downturn.

I sold 2/3 of the mortgage amount of stocks around August 28th and realized some small gains about 0.8% gain and paid 2/3 of the mortagage balance. slightly beat the interest income i could earn from treasury account and had way more flexibility

My equities position currently has respectively 2% unrealized loss and 2.4% unrealized loss in 2 accounts.

my worst performing stocks are

1. crwd, and every one knows why..
2. qcom
3. Amat.

Conclusion:

It feels to me it’s actually worth the risk of investing in equities since market can easily beat the mortgage rate with the volatility in market.

I could have gained 8% if i would have sold crwd at the beginning of July…

Just to spur some discussion for a heavily tilted discssion. At that time in June, 3/4 of redditoors said I should pay off the 7.885% mortgage.. I did the reverse.. "
Help with Roth IRA holdings,shonacb,2,https://www.reddit.com/r/investing/comments/1ff8uxd/help_with_roth_ira_holdings/,1726163686.0,"I initially opened up a Roth IRA with Wealthfront who allocated the funds into the following securities:

* VTI
* VEA
* EMB
* VWO
* VNQ
* LQD
* VT

Then I moved it over to Chase, which gives me much more control over the account and which securities I buy - in fact, I have to now actively choose which funds to put money into. Going forward, which ones should I focus on and invest in? Some of these seem really similar."
Taxes - does it make a real difference w/ ETFs? S&amp;P 500,CantRecallWutIForgot,1,https://www.reddit.com/r/investing/comments/1ff8qa0/taxes_does_it_make_a_real_difference_w_etfs_sp_500/,1726163370.0,"Hey all, I'm currently using Schwab and I had a question. I can't buy fractional shares of ETFs, so putting a certain amount in each month or whatever is off the table. The platform does have SWPPX, though, which tracks the same index and allows you to buy fractional shares. The issue is that it's a mutual fund, technically, and I've heard they're less tax-friendly than ETFs. Does it make much of a difference in this scenario, tax-wise? Is SWPPX a worse investment than SPLG or VOO?"
