Title,Author,Score,URL,Created_UTC,Content
Avoiding wash sale when moving from VOO to SPUS,cswld,0,https://www.reddit.com/r/investing/comments/1fej0dg/avoiding_wash_sale_when_moving_from_voo_to_spus/,1726083346.0,"I want to sell VOO holdings and move to SPUS (https://www.sp-funds.com/spus/) for personal religious beliefs and ethical reasons. SPUS is a subset of the S&amp;P 500 filtered to fewer companies (238 companies) based on specific compliance rules:

Would this transaction trigger a wash sale under either of these two conditions?

1. would SPUS be considered “substantially identical” to VOO ? so if i sell at a loss/gain and buy spus , can that trigger wash sale ?
2. I bought some VOO &lt;30 days ago so if i sell VOO within 30 days of buying it at a previously lower value, would that be a wash sale even if i sell it only at a gain ?

what would you recommend as the best strategy to avoid triggering a wash sale in this case ? Would only selling VOO stocks that are currently at a gain be enough?

Thanks a lot."
"When and how are you considering investment in quantum computing technologies, companies, and QCaaS? ",whimsicahellish,0,https://www.reddit.com/r/investing/comments/1fehtml/when_and_how_are_you_considering_investment_in/,1726080421.0,"In the long-term, QC investment seems like a no-trainer. Even in the mid-term there is really attractive (albeit risky) opportunities. But there are obvious risks associated with bets on any one of the immature technologies/firms given most (all?) are basically pursuing different technological appeoaches to same ends. Do you wait and see who wins/loses? Do you distribute funds across more players? Do you avoid the hardware side and instead look solely at Quantum Computing as a Service? I feel ready to start buying in, but it's hard not to see companies like Rigetti as simply a penny-stock bet, or IonQ,inc as a meme stock.  Long-story short, I'd love to start a conversation about how you're approaching QC opportunities. Thanks! "
I have multiple 401ks and 403b and I want to merge them.,Graylily,3,https://www.reddit.com/r/investing/comments/1feh9q8/i_have_multiple_401ks_and_403b_and_i_want_to/,1726079056.0,"I have multiple 401ks and a 403b that i never rolled over to each other.  The 403b has most because i was at the company the longest. My current company has an awful 401k with no match through gusto. Should I roll the 3 into my current company, or into a rolliver IRA and if so which company should I convert to that and then move the intoZ  The 401k ls are in vanguard and paychex and the 403b is in lincoln  I also have a roth at merril lynch. 

I'm mostly a set it and forget investor when it comes to these long term investments, I know low i f'd up not doing it years ago, but here we are. 

What should I be looking for? Any advice on what to do would be helpful, as I know it going to be multiple steps and I don't want to lose a lot of money just getting these into 1."
Best strategy to use on an overvalued stock? ,fav453,14,https://www.reddit.com/r/investing/comments/1fefx1l/best_strategy_to_use_on_an_overvalued_stock/,1726075724.0,"I'm relatively conservative investor (buy and hold).  I have dabbled in options (wheeling), but other than that pretty straight forward.  I have identified a stock that I think is overvalued and bound to crash, maybe not in the next few months but eventually.  I have heard of shorting but don't want to get into that.  Would buying long puts be a good way to profit from this or are there better ways to approach this?    "
Investing more % than my Company Match into 401k,LabyrinthLayers,4,https://www.reddit.com/r/investing/comments/1fefj7p/investing_more_than_my_company_match_into_401k/,1726074778.0,"Hello all - I tried to browse for a similar post, but couldn’t find one. I don’t have many people in my circle (family or friends) who would know the answer to this, hoping for some insights here! I am 25 years old &amp; make roughly $60k/y for context.

If my company matches 50% up to 6%, should I limit my contributions to my work-affiliated 401k to that amount? I also have a personal 401k with Schwab, which is riskier because it’s mainly stocks (growth &amp; legacy), and I try to contribute 6-7% there monthly as expenses allow. Currently, I contribute 8% to my company 401k, which is 2% over their match. Am I potentially allocating too much of my monthly goal of 15% of my income to this specific investment vehicle?

TIA!"
Roth IRA - Changing investment plans to optimize returns,Ok_Assignment4100,1,https://www.reddit.com/r/investing/comments/1fefgh5/roth_ira_changing_investment_plans_to_optimize/,1726074603.0,"I currently and recently invested a couple months ago in both FSKAX &amp; FTIHX in my Fidelity Roth IRA. However, I may just want to sell all my shares of those and put 100% everything into VT. And in my taxable account, I may just invest into VTI &amp; VXUS (I probably won’t have much to invest as I fully max out each year into my 401k and Roth IRA).

Just a few questions with this approach:

1) Selling my shares to buy the VT ETF: Would that affect my long-term growth potential? Or only withdrawing early before 59.5 years?

2) For both my Roth IRA &amp; taxable account: When would it be a good idea to start adding a bond ET: I'm currently in my late 30s and looking to invest until I'm in my early to mid 60s.

3) For my taxable account: What are the benefits of having a VTI &amp; VXUS combo? I'm hearing a lot abous Foreign Tax Credits (FTC) with VXUS, but how does that applyto my situation as I'm looking to retire in the United States (For now).

Thank you! "
Is this the perfect Roth portfolio?,Kr1s2phr,0,https://www.reddit.com/r/investing/comments/1fefa6p/is_this_the_perfect_roth_portfolio/,1726074169.0,"I’ve been spending a few weeks trying to figure out the right allocations for my ROTH. And I believe I have finally come up with something great. I’ll use this setup going forward.

I’ve used Portfolio Visualizer and PortfoliosLab to come up with these statistics. The benchmark is VOO.  Back tested from 1985 to 2024. Initial amount $10k. Dividends reinvested. 

Let me know what you guys think.

MAIN: 22%
DGRO: 30%
MAGS: 15%
VONG: 33%


PORTFOLIO VISUALIZER 
Portfolio return:         21.5%
Benchmark relative:  2.0%
Standard deviation:  8.0%
Drawdown:                 1.6%

PORTFOLIOS LAB
Risk adjusted: 85
Sharp:    85. (2.22)
Sortino:  81.  (2.94)
Omega:  86. (1.40)
Calmar:  88. (3.06)
Martin:   85.  (11.46)

https://portfolioslab.com/portfolio/ky0hf054ophkmpl1izazr0st"
What age and salary did you first max your ROTH IRA?,BusinessBabaBoi,51,https://www.reddit.com/r/investing/comments/1fedamh/what_age_and_salary_did_you_first_max_your_roth/,1726069321.0,"Question in title. Just wondering if there’s a general consensus as to when it’d be the smartest.

I know everyone’s living situation is different with rent/kids/varying cost of living etc. but would think it’d be fun to know how everyone goes about it! 

Also apparently Robinhood IRA match doesn’t count towards the $7k limit so you could have $7,210 in your Roth this year. 

The more you know 

Edit: forgot to put my own! I’m 24 just maxed on 85k salary living from home. "
Are gold miners a good hedge against geopolitical risk?,Ou_deis,0,https://www.reddit.com/r/investing/comments/1fed02m/are_gold_miners_a_good_hedge_against_geopolitical/,1726068603.0,"Goldman Sachs recently recommended gold as a hedge against geopolitical risk. Can (some) gold miners also act as an effective hedge against geopolitical risk? Or would any benefits to them be nullified by other factors, like negative impact on supply chains? Obviously geopolitical risks in the countries where their mines are located  could potentially threaten the mines themselves... but I'd guess it's very unlikely that geopolitical turmoil outside those countries, particularly the (hopefully remote) possibility of China invading Taiwan, would negatively impact their operations?"
"Sold a piece of investment property netted 625k. I intend to use it to buy more real estate, where should I park this money?",Swoopysloop,0,https://www.reddit.com/r/investing/comments/1fe896w/sold_a_piece_of_investment_property_netted_625k_i/,1726055696.0,"So this deal is part of the larger transactions that’s gonna be over two years. My goal is to double it by then. Considering putting this cash in the money market account or somewhere else that’s earning a decent amount of return or I can tap it if and when I find the next deal. The problem is real estate doesn’t make sense right now, so I’d rather park it somewhere to earn some interest and have it sitting in the savings account. 

I’ve been looking around at Schwab and Edward Jones and everyone hates those big firms. And I don’t quite trust financial advisors as my aunt lost a half million dollars on a bad investment presented to her by financial advisor as the next big thing.

For context, I didn’t come for money. I was homeless at 18 when mom and I got evicted.  My goal has been to leave a legacy for my kids that I never had. It’s going well so far, but obviously the goal is to do better. 

TIA!

Edit: I should’ve been more clear, I don’t use ChatGPT to write things better. 😂My goal is to just put this money somewhere until I can find another real estate transaction to roll into. Real estate doesn’t make sense right now. Rates are high and property is overpriced. It sucks for people just getting in. I’m literally just looking for a medium that I can put cash into and sit on it. 

I’m not sure why I’m getting all the hate, I’m not some rich hedge fund. I’m married with two kids and want to give them a better life than I had."
Someone try and talk me out of going 50% BRK 50% VOO ,Spiritual_Food_8300,0,https://www.reddit.com/r/investing/comments/1fe6oo0/someone_try_and_talk_me_out_of_going_50_brk_50_voo/,1726049938.0,"Berkshire Hathaway is one of the most successful performing ETFs disguised as an individual stock. Its historical performance is undeniably far more impressive than the S&amp;P 500s. 

I’d love to go in with an open mind and hear everyone else’s thoughts on this take. "
Portfolio allocation plan,UpbeatGarden3746,2,https://www.reddit.com/r/investing/comments/1fe5ucn/portfolio_allocation_plan/,1726046336.0,"24 yo. $6000 to invest in a long-term horizon. I already have $10000 in bonds.

My portfolio allocation plan is currently:

60% Vanguard U.S. 500 Stock Index Fund  
15% Amundi Index MSCI Emerging Markets  
25%: Echiquier Artificial Intelligence

How do you see it? Is it too risky? Not too diversified? Too diversified? Should I take away money from bonds and allocate part of it to equities? Do you have any other portfolio plan that might be better suited?

I plan to add another $6000 next year."
"Daily General Discussion and Advice Thread - September 11, 2024",AutoModerator,10,https://www.reddit.com/r/investing/comments/1fe5lwy/daily_general_discussion_and_advice_thread/,1726045268.0,"Have a general question?  Want to offer some commentary on markets?  Maybe you would just like to throw out a neat fact that doesn't warrant a self post?  Feel free to post here! 

If your question is ""I have $10,000, what do I do?"" or other ""advice for my personal situation"" questions, you should include relevant information, such as the following:

* How old are you? What country do you live in?  
* Are you employed/making income? How much?  
* What are your objectives with this money? (Buy a house? Retirement savings?)  
* What is your time horizon? Do you need this money next month? Next 20yrs?  
* What is your risk tolerance? (Do you mind risking it at blackjack or do you need to know its 100% safe?)  
* What are you current holdings? (Do you already have exposure to specific funds and sectors? Any other assets?)  
* Any big debts (include interest rate) or expenses?  
* And any other relevant financial information will be useful to give you a proper answer.  

Please consider consulting our FAQ first - https://www.reddit.com/r/investing/wiki/faq
And our [side bar](https://www.reddit.com/r/investing/about/sidebar) also has useful resources.  

If you are new to investing - please refer to Wiki - [Getting Started](https://www.reddit.com/r/investing/wiki/index/gettingstarted/)

The reading list in the wiki has a list of books ranging from light reading to advanced topics depending on your knowledge level. Link here - [Reading List](https://www.reddit.com/r/investing/wiki/readinglist)

Check the resources in the sidebar.

Be aware that these answers are just opinions of Redditors and should be used as a starting point for your research. You should strongly consider seeing a registered investment adviser if you need professional support before making any financial decisions!"
"need to find some correct terms about a investment behavior
",ww-stl,2,https://www.reddit.com/r/investing/comments/1fe0ni6/need_to_find_some_correct_terms_about_a/,1726025107.0,"When you find an important investment opportunity that may not appear a second time,it would force you invest as much as possible————if you don't invest fully enough, you won't get enough profit.

Especially when this opportunity may only come once. Even it forces you to invest fully (even all in) ,even if you will miss other potential opportunities or take great risks. and is not suitable for half-hearted investment(In this case, half-hearted investing behavior not only means you miss out on opportunities, but still taking risks.).

so what are the technical term for such case?"
Keeping track of dividends? ,Current-Schedule1781,1,https://www.reddit.com/r/investing/comments/1fe0gif/keeping_track_of_dividends/,1726024489.0,"

I'm pretty new and just playing with stocks at this point. How do you keep track of dividends so you can see your actual total gain with a dividend stock vs a normal stock. Do you have to dust off ol excel? Using Robinhood maybe real platforms have a better way? 

This text is just to make my post longer no need to read. Apparently there is a minimum number of characters to post in this subreddit. I'm not sure how this weeds out any posts but makes it so post are just longer and more wordy? "
Active investing vs paying off debt,below298,0,https://www.reddit.com/r/investing/comments/1fdyv3i/active_investing_vs_paying_off_debt/,1726019411.0,"Hi everyone I'm curious.

If I have personal debt but high income; should I focus 100% on debt elimination until I'm debt free or should I also in the meantime look into short term ROI stock investments while I pay my debt off?

Any tips or precentages on financial allocations would be much appreciated!!"
"Roth IRA question, 18. First time",Appropriate-Fan-9855,0,https://www.reddit.com/r/investing/comments/1fdvjj7/roth_ira_question_18_first_time/,1726009381.0,"I understand I need to make at least $7k while working to max out my Roth but can I use the $7k I’ve made from stock options this year?? Or does it have to be an actual job. I have about $20k saved up but I haven’t been working a genuine job this year due to college, I’m almost 19 and want to max out my IRA. Any help is appreciated "
"Help with Vanguard 529 Basics and ""CalKIDS"" Program in California",AlecJTrevelyan,1,https://www.reddit.com/r/investing/comments/1fdtxcb/help_with_vanguard_529_basics_and_calkids_program/,1726004976.0,"Just welcomed a newborn a few months ago.  I'm familiar with IRA (Roth), 401k, pension, etc. as I have all three.  Not too familiar with 529.  From what I understand, a 529 plan is basically the same concept as a Roth IRA.  Post-tax money where the growth is tax free at the Federal level so long as distributions are made for qualifying expenses.  

When I went on the Vanguard website, it looks like you need $3,000 minimum to buy into one of the 529 ""funds.""  Do I have to buy into one of these funds?  Or, can I just open a 529 and buy ETF's like VOO on my own?

Also, I got a letter from CalKIDS and opened up an account to find a $100 in there.  Is this program legit?  Is it a State-sponsored program?"
Cost Basis difference in Chase Brokerage vs Robinhood when exercising call options,browndroid,1,https://www.reddit.com/r/investing/comments/1fdpqfh/cost_basis_difference_in_chase_brokerage_vs/,1725994508.0,"I have exercised call option contracts on both Chase and Robinhood, and I noticed a difference in the way cost basis is calculated. While Chase ensures that the options premium paid is added to the cost basis, Robinhood conveniently ignores the premium paid and displays the cost price as the strike of the options contract. Wondering why there is such a discrepancy for calculating the cost basis across these two brokerages. Does anyone have any insights they can share?"
The permanent 2% allocation dilemma,Constant_Air1532,0,https://www.reddit.com/r/investing/comments/1fdpov0/the_permanent_2_allocation_dilemma/,1725994400.0,"Hey guys,

I just had a wild thought that lines up with how Peter Lynch would buy and sell entire sectors. For context, I’ve been running money and dabbling in the microcap space for about a decade now.

So here’s the crazy idea: what if, when building a microcap portfolio, you just allocated 2% of your initial portfolio to each new idea? Then, instead of obsessing over every move, you just let them ride (good or bad) in a bid to capture the real magic of compounding: time in the market.

What do you think?"
Is investing in small cap stocks at the moment a good idea for alpha? WSJ had an article yesterday suggesting the same,Realistic_Criticism8,3,https://www.reddit.com/r/investing/comments/1fdmuqk/is_investing_in_small_cap_stocks_at_the_moment_a/,1725987532.0,I ended up buying a few shares of VBR but idk if I would be better off just going with VOO instead? Would like to discuss where small cap stocks are headed assuming there are a few rate cuts. What is your opinion? Should one invest in small cap stocks atm to take advantage of the current economic climate- or is this already likely priced in?
Lets take a lot at HR Management Software,TickernomicsOfficial,0,https://www.reddit.com/r/investing/comments/1fdjmm3/lets_take_a_lot_at_hr_management_software/,1725979541.0,"Lets talk the Human Capital Management Software industry. The 3 biggest players are [$ADP](https://x.com/search?q=%24ADP&amp;src=cashtag_click) [$PAYX](https://x.com/search?q=%24PAYX&amp;src=cashtag_click) [$PAYC](https://x.com/search?q=%24PAYC&amp;src=cashtag_click).  Even as competition has entered the industry ADP &amp; PAYX have keep high client retention. The two seem to have strong moats and trade at close multiples. Right now we have ADP a bit ahead of PAYX due to their stronger brand name trading at a slightly lower multiple. We have ADP compounding at 15.3% while PAYX is projected to compound at 13.5%.

[https://imgur.com/a/USbffqa](https://imgur.com/a/USbffqa)

"
Should I roll my 401k into my Traditional IRA and then convert to Roth at age 30?,Im_The_One,0,https://www.reddit.com/r/investing/comments/1fdi76z/should_i_roll_my_401k_into_my_traditional_ira_and/,1725975785.0,"Trying to figure out if it's a good idea to roll over my current 401k into an IRA and then do a Roth conversion. 

* Current age: 30
* Amount in 401K: $21.6k
* Annual Income: $350k

The estimated taxes on the conversion would be about $8.6k. Is it worth it to roll this over? My new job starts it's 4% match on Jan 1, 2025, so that is when I was planning on starting to max out new 401k every year."
Inheritance - asset price and asset income discrepancy in europe,Actual-Double-2719,0,https://www.reddit.com/r/investing/comments/1fdhh0z/inheritance_asset_price_and_asset_income/,1725973755.0,"Me and my wife both inherited a good junk of farmland, which in my area has a value of around 20mm. problem is, our families have owned that land for some couple hundreds of years (we are based in europe not US) and so the emotional constraints are fairly large. Also, the combined rental income for the farmland is only approx. 50k p.a.. That would be an astonishing 0.25% return on capital before tax. And i am not joking to you - our market is completely out of balance.

  
We also have the same problem with houses. We both will inherit 2-3 houses each and every single one has to be renovated which would ultimately eat all profits for 20-30 years. Pay for renovation would be around 3k/sqm and would yield around 10€/sqm/month when rented out. I mean come on.

  
I know this is a very privileged problem (we both had the pure luck of beeing born into very old families - though no aristocracies), but it still bothers me. take 25 million on any conservative investment with like 5% return and you have 1.25 mill per year for generations to come. What is this market in europe? i dream of beeing in the US. What would you do? Try to make the best out of the situation and rent everything out - though huge miss on capital gains or just try to convince the families to sell everything/parts of it and invest otherwise? "
"Daily General Discussion and Advice Thread - September 10, 2024",AutoModerator,4,https://www.reddit.com/r/investing/comments/1fdddmk/daily_general_discussion_and_advice_thread/,1725958868.0,"Have a general question?  Want to offer some commentary on markets?  Maybe you would just like to throw out a neat fact that doesn't warrant a self post?  Feel free to post here! 

If your question is ""I have $10,000, what do I do?"" or other ""advice for my personal situation"" questions, you should include relevant information, such as the following:

* How old are you? What country do you live in?  
* Are you employed/making income? How much?  
* What are your objectives with this money? (Buy a house? Retirement savings?)  
* What is your time horizon? Do you need this money next month? Next 20yrs?  
* What is your risk tolerance? (Do you mind risking it at blackjack or do you need to know its 100% safe?)  
* What are you current holdings? (Do you already have exposure to specific funds and sectors? Any other assets?)  
* Any big debts (include interest rate) or expenses?  
* And any other relevant financial information will be useful to give you a proper answer.  

Please consider consulting our FAQ first - https://www.reddit.com/r/investing/wiki/faq
And our [side bar](https://www.reddit.com/r/investing/about/sidebar) also has useful resources.  

If you are new to investing - please refer to Wiki - [Getting Started](https://www.reddit.com/r/investing/wiki/index/gettingstarted/)

The reading list in the wiki has a list of books ranging from light reading to advanced topics depending on your knowledge level. Link here - [Reading List](https://www.reddit.com/r/investing/wiki/readinglist)

Check the resources in the sidebar.

Be aware that these answers are just opinions of Redditors and should be used as a starting point for your research. You should strongly consider seeing a registered investment adviser if you need professional support before making any financial decisions!"
"Is the concept of ""Equity Risk Premium"" shrinking over time?",DottMySaviour,16,https://www.reddit.com/r/investing/comments/1fdcj3a/is_the_concept_of_equity_risk_premium_shrinking/,1725954996.0,"When I first learnt about investing and studied it from free online materials, I found it very strange that Equity Risk Premium (ERP) is a thing because in my mind, if the market is pricing a stock fairly, it should account for the risk in future cashflows/dividends (earnings) by lowering expectation in earnings instead of ""demanding more returns"" by having ERP. Academic concepts like ""stock beta"" make zero sense no matter how I try to rationalise it.

A few years ago, I also came across Equity Premium Puzzle (EPP) which shows equities have outperformed debt significantly (by 5% to 8%) even when considering survivorship bias. There are studies with over 100 years of data. Since survivorship bias cannot explain EPP, I concluded that perhaps humans are just not very good at pricing equities fairly relative to debt and overcompensate for the risk of equities.

Right now, it seems like every stock is expensive and I'm wondering if this is going to be the new normal. As technology gets better thus access to public information (e.g. company info, economic news, world events, etc) gets easier, and more younger people learning about investing online (since schools around the world don't teach personal finance ever), are equity prices just going to be priced higher (i.e. lower ERP) because now the equity market gets more competitive?

ERP and EPP have always been a very interesting topic to me, but it's hard to find any deep discussion on this."
Financial Advisors - Private/Hard Money?,HighDesert505,1,https://www.reddit.com/r/investing/comments/1fdc2q6/financial_advisors_privatehard_money/,1725952857.0,"This question is for financial advisors. 

Do any of yall have clients who you’ve helped guide on doing private/hard money lending to real estate investors.

I’m curious if that’s even a route that financial advisors will guide there clients through. I’t seems majority of financial advisors assist with helping people invest in intangible assets like stocks, mutual funds, etc. 

"
