Title,Author,Score,URL,Created_UTC,Content
Question re Buying 20-Year Bonds when Rates Falling ,BlueCyber007,0,https://www.reddit.com/r/investing/comments/1ff8ow0/question_re_buying_20year_bonds_when_rates_falling/,1726163272.0,"I want to buy some 20-year Treasury Bonds in the current auction, which is for CUISP 912810UD8, issued 2024-08-15 with a rate of 4.125%. The indicative/expected yield (per Vanguard and Fidelity) is 4.083%.

Am I correct that the price will, therefore, be higher than par (e.g., $103 per $100)?

If so, if I placed an order for 10 bonds ($10,000 face value), then the amount due at settlement would be some unknown amount more than $10,000. How can I reasonably estimate what that amount would be?

In other words, if I want to invest $10,000 in the 20-year Treasury Bonds (i.e., I have $10k available to spend), how would I figure out the correct face value to order so that I can actually pay for the purchase?"
Dividend Stocks vs Index ,proteinsynthesisman,19,https://www.reddit.com/r/investing/comments/1ff8i6k/dividend_stocks_vs_index/,1726162813.0,"Question, why would someone want to invest in a high dividend fund over just your normal S n P 500 index fun? 

In a podcast I listen to, they often recommend SPYI and praise the dividend income they receive. 

The way I see it, if that money was just invested in something like VOO they would be up much more for the year. And if you are taking your dividends out and spending them, would you ever expect the fund to really grow in value due to you not reinvesting? "
where to invest if the world is projected to become rainier?,greatbear8,0,https://www.reddit.com/r/investing/comments/1ff81kp/where_to_invest_if_the_world_is_projected_to/,1726161656.0,"Hello all!

Where would you invest if some kind of modelling, let us say climate modelling, shows a significant ramp-up in precipitation globally, that is, storms and the like (even in the Middle East)?

I have thought about it, and maybe I would avoid insurance companies' stocks to begin with, but what to buy? Companies that build roads and dams? But they are often very big companies who are also into other types of construction.

Any other sectors?"
How do I get myself out of the fear due to uninverting yield curve?,confused-student1028,0,https://www.reddit.com/r/investing/comments/1ff6hnl/how_do_i_get_myself_out_of_the_fear_due_to/,1726157795.0,"Almost every time (I think only one exception in the past century) when inverted yield curve becomes uninverted, economy goes on a downturn if not a straight up recession, and stocks drop or crash. 

Yield curves just uninverted this week, and I pulled everything out of the stock market in fear of just that- if my money was in snp500 in 2000 it would take 7 years to come back after the crash, and one year later it would crash again and not to come back for another 6 years.

What makes it different this time? Is it wise to hold off most money from stocks in the next year?"
Avoiding settled funds violations,a_printer_daemon,1,https://www.reddit.com/r/investing/comments/1ff4ty5/avoiding_settled_funds_violations/,1726153619.0,"I understand why we settle funds first. E.g., Don't want a free ride violation. But what about the following:

1. I have held stock X for a year, but want to sell off my position.
2. I sell stock X and get $500.
3. I *reinvest* the same day into stock Y, which I plan to hold, without waiting for the settlement period to elapse.

Are there violations that could still occur in this scenario? Since X sold I will have the money, and if I'm looking to hold Y, then I'm not going to be free riding (minimally). Is this safe, or should I just wait?  

Edit: Concensus (and broker's advice) says this is good as long as selling of Y doesn't occur. Looks like we are good!

Mods, feel free to close to commentary if you see this."
Dividend Investing Question,Ok_Assignment4100,0,https://www.reddit.com/r/investing/comments/1ff4hhd/dividend_investing_question/,1726152746.0,"I came across this known YouTuber, and he mentions that you can take out your principle investment any time by selling it if you no longer wish to hold onto a stock. And you will not lose your principle / initial investment. Here's the video:

https://www.youtube.com/shorts/IKQNmcE8Zvk

Obviously, the changes that matter is dividend yield% and the share price. Otherwise, is this true?"
" It’s easy to buy gold, how /where do I sell it?",moonbunR,158,https://www.reddit.com/r/investing/comments/1ff40k9/its_easy_to_buy_gold_how_where_do_i_sell_it/,1726151535.0,"A lot of people talk about how easy it is to buy gold—whether it’s from big retailers like Costco, online dealers, or even local shops. However, once you’ve accumulated gold bars or coins, the big question becomes: how do you sell it, and where?

For example, who buys gold from individuals like us? Is there a marketplace or a network of dealers who are specifically interested in purchasing gold? And how is the selling price determined? I know the gold market has fluctuating spot prices, but does that fully control what you’ll be paid? Are there fees or deductions to expect from the buyer, and if so, how do those typically work?

Another thing I’m curious about is the process itself. Is selling as straightforward as walking into a shop or dealer with your gold bars, or is it more involved? Do you need certain paperwork or certificates of authenticity to get the best value? For those who’ve gone through it, how was your experience? Were there any surprises, such as the buyer's inspection process or additional costs like testing?

I’m asking because I’ve heard mixed opinions. Some say the resale market can be a bit tricky due to premiums, buyer fees, and market demand. Others say it’s as simple as finding a trusted dealer or listing it on a marketplace. I’m interested in hearing about real experiences from anyone who has sold their gold bars or coins. How did you find a buyer, and was the process smooth or difficult? "
Presidential elections and the market ,smegma-man123,0,https://www.reddit.com/r/investing/comments/1ff3oam/presidential_elections_and_the_market/,1726150654.0,"How do presidential elections historically affect the market ?

Do people hold back and wait in the months prior ? 

Is there a historical trend based on dems vs republicans winning and ensuing market trends?

How do you think markets would react specifically to Harris vs Trump
Victory? 

I have a large sum I want to DCA into index funds on a 5 year horizon and I am wondering if I should wait until after the election. 

Thank you kindly for your time. "
"EU cuts rate to 3.65 from 4.25, now let’s see what will be US’s decision next week",alexc2020,0,https://www.reddit.com/r/investing/comments/1ff1qw3/eu_cuts_rate_to_365_from_425_now_lets_see_what/,1726145348.0,"The European Central Bank on Thursday delivered a quarter-point interest rate cut, marking its second reduction to the deposit rate this year.

The widely anticipated move comes after a period of sluggish economic growth across the euro zone and cooling inflation, which fell back toward the central bank's 2% target in August.

The ECB lowered its 2024 growth forecast to 0.8%, down slightly from an earlier projection of 0.9%, citing ""weaker contribution from domestic demand over the next few quarters.""

https://www.ecb.europa.eu/stats/policy_and_exchange_rates/key_ecb_interest_rates/html/index.en.html
"
Leading Market Platforms and Utilities,Juicebo-x,0,https://www.reddit.com/r/investing/comments/1ff1pnp/leading_market_platforms_and_utilities/,1726145249.0,"Hello,

I’m getting back to tracking the markets and I wasn’t ever really happy with the platforms, applications and utilities I was using the last time I was trying to keep up with things day-to-day. 

I currently lean heavily on Schwab’s platform and ToS, as well as the stocks app on my iPhone now that I switched over. 

What do you all prefer? Where do you do your research? Comb news? Look at/track the markets? Please share your favorite platforms/utilities!

TIA!"
Prosper and why I hate Texas,Iron_man_wannabe,0,https://www.reddit.com/r/investing/comments/1ff15ab/prosper_and_why_i_hate_texas/,1726143484.0,"*Edit.  Wow.  This was meant to be a bit sarcastic and more or less stating that I didn't think any government should limit where anyone puts their money.
Also, I clearly state that I'm not a savvy investor and also very facetiously state that stocks go down when I buy them.  Meant as a self-deprecating joke.
I have other investments.  Some are doing well.  

Just a quick rant.  I'm not what one would call a savvy investor.  I joke with friends and family that the only sure-fire way to make sure a stock will go down is to wait for me to buy it.

That said, early last year I invested a small amount in Prosper, which is peer to peer lending.  It is also banned from Texas due to Texas' Blue Sky laws, or so Google tells me.  Anyway, I have averaged a near 12% positive return on that and honestly just wish I could keep throwing money at it.

Literally everything else I have money in is currently at a loss.

Rant over."
Is it beneficial for the total expected returns of a stock portfolio to rebalance occasionally between individual stocks?,Former_Importance551,0,https://www.reddit.com/r/investing/comments/1ff0vob/is_it_beneficial_for_the_total_expected_returns/,1726142637.0,"Assuming efficiently priced stocks, is it beneficial for the total expected returns of a 100% stocks portfolio to rebalance occasionally between stocks, rather than to buy and hold? Why?

I imagine that it is allowing any holding to become too big increases idiosyncratic risk in the portfolio and rebalancing combats this. But perhaps this is incorrect or not the full picture?"
The issue of retaining an IRA account due to a change in work location,ValerionVaults,1,https://www.reddit.com/r/investing/comments/1ff0kzl/the_issue_of_retaining_an_ira_account_due_to_a/,1726141705.0,"I'll be transferring to Hong Kong for 4-5 years due to work, which means I won't have taxable income in US during that time. Since I won't be able to contribute to my IRA account, I'm considering opening a cash account at a local brokerage in Hong Kong for short-term contributions. I know I can keep my IRA account open, but if I end up staying in Hong Kong long-term, I'm unsure whether it's worth keeping. There seems to be a fine for withdrawing money from an ira account before age 59?

Has anyone been in a similar situation? I'd love to hear your experiences and any advice you have."
Trying to find ETF allocation (4 funds).,Left_Fisherman_920,1,https://www.reddit.com/r/investing/comments/1fez4ir/trying_to_find_etf_allocation_4_funds/,1726136416.0,"Trying to find ETF allocation (4 funds).



Planning on retiring in 27 years and want to allocate the following 4 ETF’s. 



My selection is as follows:

- VUG - core holding since it’s 50% tech with a bit of diversity. I don’t like the full diversification of VOO.

- SOXQ - I believe this is going to have another run within the next 10-15 years. 

- JEPQ - I need the income to begin accumulating for a particular goal.

- SCHD - dividend and will balance out the remaining holdings.

- PLTR - holding for long term.



Poke holes in this so I can have a myriad of opinions to research more and make a better informed decision.



Thanks in advance."
Two questions about investing on apps,speedco,0,https://www.reddit.com/r/investing/comments/1feyyxe/two_questions_about_investing_on_apps/,1726135810.0,"These questions pertain to trading on an app like WeBull or Robinhood

1. If I bought 100 shares of Stock A at $10 each over a year ago.. and then I buy 10 shares of Stock A at $15 a week ago, if I sell 10 shares today at $20 each, will I pay long term or short term capital gains tax on it? 

2. When an app shows after hours percentage changes, do these after hours percentage gains and losses reflect the percentage change from the stock price at market open? Or do the after hours percentage changes refer to the percentage change from market close? "
Can I rollover my DCP into an IRA of 401k after leaving job?,PhotoJoe_,0,https://www.reddit.com/r/investing/comments/1feyega/can_i_rollover_my_dcp_into_an_ira_of_401k_after/,1726133393.0,"Basically the title. My last job had a Deferred Compensation Plan. I contributed mostly DCP, but they also had an option for Roth DCP. I left that job recently. For simplicity, I was wondering if I would be able to rollover that DCP into one of my other brokerages or accounts without creating a taxable event?

  
Thanks"
"Daily General Discussion and Advice Thread - September 12, 2024",AutoModerator,1,https://www.reddit.com/r/investing/comments/1fey0oc/daily_general_discussion_and_advice_thread/,1726131668.0,"Have a general question?  Want to offer some commentary on markets?  Maybe you would just like to throw out a neat fact that doesn't warrant a self post?  Feel free to post here! 

If your question is ""I have $10,000, what do I do?"" or other ""advice for my personal situation"" questions, you should include relevant information, such as the following:

* How old are you? What country do you live in?  
* Are you employed/making income? How much?  
* What are your objectives with this money? (Buy a house? Retirement savings?)  
* What is your time horizon? Do you need this money next month? Next 20yrs?  
* What is your risk tolerance? (Do you mind risking it at blackjack or do you need to know its 100% safe?)  
* What are you current holdings? (Do you already have exposure to specific funds and sectors? Any other assets?)  
* Any big debts (include interest rate) or expenses?  
* And any other relevant financial information will be useful to give you a proper answer.  

Please consider consulting our FAQ first - https://www.reddit.com/r/investing/wiki/faq
And our [side bar](https://www.reddit.com/r/investing/about/sidebar) also has useful resources.  

If you are new to investing - please refer to Wiki - [Getting Started](https://www.reddit.com/r/investing/wiki/index/gettingstarted/)

The reading list in the wiki has a list of books ranging from light reading to advanced topics depending on your knowledge level. Link here - [Reading List](https://www.reddit.com/r/investing/wiki/readinglist)

Check the resources in the sidebar.

Be aware that these answers are just opinions of Redditors and should be used as a starting point for your research. You should strongly consider seeing a registered investment adviser if you need professional support before making any financial decisions!"
Good idea to buy bond funds before the rate cut?,mrandr01d,6,https://www.reddit.com/r/investing/comments/1feurzv/good_idea_to_buy_bond_funds_before_the_rate_cut/,1726117694.0,"Hey all, 

First time in this sub, looking for some advice. I have my emergency fund sitting in a money market find getting about 5% right now. This is fine, but with the fed's rate cut coming up next week, I figure that interest rate is going to go down. I'd like to preserve getting the higher interest rate. 

If I need to dip into this emergency fund, I won't need all of it for quite some time.

Are there any bond funds that would be a good buy before the rate cut to preserve the higher interest I'm currently getting on my emergency fund? What are some things to look for with bond mutual funds?"
Understanding my employer match,partlycloudy531,1,https://www.reddit.com/r/investing/comments/1feu7uu/understanding_my_employer_match/,1726115624.0,"Employer matching contributions:
&gt;&gt; 100% of contributions on the first 3% of eligible salary
plus 50% of contributions on the next 2% of eligible salary

I am trying to figure out how much I need to contribute to get the maximum match from my company 401k. My salary is $100k a year. If I understand this correctly, the max they will contribute is 5% of my salary, which is $5k. So the first $3k I put in, they will match with another $3k? Then to get the last $2k I need to contribute $4k? So that means I need to contribute $7k to get the max match of $5k? It’s confusing though because when I look at YTD contributions, I’ve contributed $6,665 so far and my match is at $3,974. I feel like there is some math I’m not understanding. But mostly I just want to know what my contribution percentage needs to be so I get exactly the full match. 
"
Strategies to de-densify $1m in employee stocks,Antique_Cut8181,11,https://www.reddit.com/r/investing/comments/1fet0al/strategies_to_dedensify_1m_in_employee_stocks/,1726111389.0,"Hi there, fortunate enough to have vested $1m in company stocks. What strategies are out there to de-densify, and are there tax strategies as well?

Was thinking I should start making big sales and putting chunks into VOO, but would love thoughts on detailed approaches. Tia"
Does any company provide a hybrid or a combo managed/self directed account?,las2k,2,https://www.reddit.com/r/investing/comments/1fes2zs/does_any_company_provide_a_hybrid_or_a_combo/,1726108366.0,"Question in title.

Does any company provide a hybrid or a combo managed/self directed account?

Are there any companies that provide a combo or a hybrid sort of account that is managed and also self directed?

Please provide if anything like this exists in the US.

Taxable or non-taxable combo/hybrid managed/self-directed account.
"
Two-wheel &amp; three-wheel EVs sector play,zizala_2003,9,https://www.reddit.com/r/investing/comments/1feqsr5/twowheel_threewheel_evs_sector_play/,1726104465.0,"Is anyone aware of a mutual fund or ETF that focuses on two- and three-wheeled electric vehicles as a sector. I don't mean a broader EV or autonomous vehicle sector fund that might incidentally include 2 &amp; 3 wheel manufacturers, but rather a fund that focuses on the emerging (and established) players in this domain? "
Should I liquidate or just transfer assets,Separate-Row2424,0,https://www.reddit.com/r/investing/comments/1feqjaa/should_i_liquidate_or_just_transfer_assets/,1726103663.0,"I am about to fire my financial advisor and am going to manage my own account. I have Wells Fargo and 5 accounts with them. Two 529's for my kids, one IRA, one stock account and one managed account. 

The total of all the accounts are around $35k. Should I just transfer all the assets out to another brokerage (I was thinking Fidelity since I already have an account with them but I am open to suggestions).

Not sure if I would have to sell everything in the managed account/IRA/529 which has most of my account value, but I am pretty sure I would be paying long term gains tax on these assets. 

What is the best way to go about this? "
Home equity investment advice!!,suyogshah,4,https://www.reddit.com/r/investing/comments/1fepspu/home_equity_investment_advice/,1726101452.0,"Hello friends, 

We recently purchased our home and we have managed to build an equity of around 80k.

I need some suggestions whether we should take out this money and invest in the market when we refinance.

Current rate : 6% APR - 15 years
Estimated new rate : 5% APR - 15 years

"
What's the best investment strategy for aging seniors?,rokizazin77,12,https://www.reddit.com/r/investing/comments/1fen5o8/whats_the_best_investment_strategy_for_aging/,1726093967.0,"Looking for advice on the best investment strategies for mid-60s parents. We are approaching the sale of their primary residence, which will provide them the funds they will have (along with a very small amount of social security) to live out the rest of their lives. The facts:

* They will have around $300k to invest.
* They did not save *any* additional funds for retirement.
* Their combined social security, their only income, is around $2,000 a month. It pays for their healthcare and rent.
* They do not intend to buy again; they are currently renting at around $1,000 a month.
* They have moderate–to–severe health complications that require in-home equipment and high prescription use. One has a progressing cancer.
* They have a relatively short projected timeline before either death or the need for 24/h care—about 5–7 years at most.

What would be the smartest way for seniors in situations like these to modestly grow their remaining funds?"
Roth IRA investment options for a 23 yo female (QQQ or QQQM),TboneTheHamster,0,https://www.reddit.com/r/investing/comments/1femfri/roth_ira_investment_options_for_a_23_yo_female/,1726092060.0,I am a 23 yo female and I recently opened my Roth IRA with 5000 invested. Majority in VOO and then some small investments in single stocks. I want to invest in an ETF following Nasdaq since I have SP500. I am debating between QQQ and QQQM. What would be the best for me to invest in for long term retirement? I feel like QQQM has great potential since its newer and market share is fractional compared to QQQ - is this a correct judgement? 
How does a Roth IRA grow exponentially?,TaintDempsey,0,https://www.reddit.com/r/investing/comments/1fekz4y/how_does_a_roth_ira_grow_exponentially/,1726088289.0,"Can you help me wrap my head around how a Roth IRA results in exponential growth after x years? In a HYSA I can understand exponential growth. You invest 1000 dollars, then after 1 year of 4% interest, your new balance is $1040. Then after another year you get 4% of that and it grows exponentially year after year. 

But how does this work in an IRA? You don't gain interest, the stock is just worth more over time. And with reinvesting dividends being such a small amount, I don't understand how this grows exponentially. This makes it seem to me that a Roth IRA is just a regular brokerage acct, just one you don't pay taxes on in the back end.

Am I misunderstanding something or missing information somewhere?

Edit: I was adding the percent increase year after year, instead of compounding it

I now understand why it compounds instead of just getting added, I'd like to thank everyone for working with me as I struggled to understand this concept. I'm going to keep this post up just in case any other regarded individuals struggle to grasp basic concepts. Again, thank you. "
ETFs: Physical Certificate or DRS?,JusticeForSimpleRick,0,https://www.reddit.com/r/investing/comments/1fejro1/etfs_physical_certificate_or_drs/,1726085239.0,"
Hi everyone,

I’m evaluating whether to hold my ETFs as physical stock certificates or in a digital registered form (DRS). Both options are offered by my brokerage with the same fees, and I'm curious about the practical implications of each choice.

I'm particularly interested in the security and risk associated with physical certificates, especially in terms of reissuance if lost. Given that these shares wouldn't update on the physical certificate under a Dividend Reinvestment Plan (DRIP), how well does this system work in practice? How are dividends managed—do I receive direct deposits, or will I get notifications from the transfer agent?

My preference for physical certificates stems from wanting to avoid the transactional pressure of brokerage UIs, which seem designed to encourage frequent trading. I’m interested in long-term, focused investing without these distractions.

Could anyone share their experiences or insights on:

* Security measures for protecting physical certificates.
* Any legal or tax differences encountered with physical vs. digital holdings.
* How long-term accessibility might be affected by opting for physical certificates.

I appreciate your help and respect everyone’s investment choices. If you're more inclined to question this approach rather than offering advice, please consider this a call for experiences and insights only.

Thanks in advance!"
Why is the $3000 capital loss deduction so low?,LarBrd33,270,https://www.reddit.com/r/investing/comments/1fejp13/why_is_the_3000_capital_loss_deduction_so_low/,1726085060.0,"I get you can apply capital losses against capital gains to minimize your taxable gains.  I get there is a carryover where if you take more losses than gains, you can apply those losses against future gains.  I get that there is a $3000 capital loss deduction where if your losses exceed your gains, you can apply $3000 against your ordinary income.  

I just don't get why that value is so low.  Like, one year I took over 100k in losses (sounds worse than it was) and I suppose if I never were to have gains, I could just apply it against $3000 in annual income for the next 33 years.  $3000 seems like such a small amount, though.  I asked ChatGPT:

&gt;The **$3,000 capital loss deduction limit** has remained unchanged for individuals since it was established under the **Tax Reform Act of 1976**. Since then, the limit has neither increased nor decreased, even though inflation has eroded its value over time. The limit was originally set at $3,000 to allow taxpayers to offset other income with investment losses, but it has not been adjusted for inflation in the decades since its introduction.

Adjusted for inflation, $3000 in today's dollars would be $16,583.83.    That amount makes a lot more sense to me.   Why hasn't this been increased in decades?  "
